{
  "schemaVersion": 2,
  "batchId": "1111111111111111111111111111111111111111111111111111111111111111",
  "mode": "baseline",
  "cursor": {
    "from": 0,
    "to": 128
  },
  "source": {
    "id": "source-example-root",
    "deviceId": "device-example",
    "provider": "codex",
    "nativeSessionId": "native-example-root",
    "nativeParentSessionId": null,
    "classification": "fixture",
    "pathHash": "aaaaaaaaaaaaaaaaaaaaaaaaaaaaaaaaaaaaaaaaaaaaaaaaaaaaaaaaaaaaaaaa",
    "epoch": 1,
    "sourceSize": 128,
    "capturedAt": "2026-08-01T12:00:00.000Z"
  },
  "session": {
    "id": "session-example-root",
    "kind": "root",
    "title": "Synthetic protocol fixture",
    "project": "/example/habitat-fixture",
    "model": "example-model",
    "status": "active",
    "startedAt": "2026-08-01T11:59:00.000Z",
    "updatedAt": "2026-08-01T12:00:00.000Z",
    "attributes": {
      "fixture": true
    }
  },
  "events": [
    {
      "id": "event-example-1",
      "sequence": 0,
      "kind": "user_message",
      "actor": "user",
      "occurredAt": "2026-08-01T11:59:00.000Z",
      "content": [
        {
          "type": "text",
          "text": "Synthetic fixture content only."
        }
      ],
      "text": "Synthetic fixture content only.",
      "toolName": null,
      "attributes": {},
      "usage": {
        "inputTokens": 0,
        "outputTokens": 0,
        "cachedInputTokens": 0,
        "cacheCreationInputTokens": 0,
        "reasoningOutputTokens": 0
      }
    }
  ],
  "redaction": {
    "version": "1",
    "replacements": 0
  }
}
